{
  "$schema": "../../schemas/image-model.schema.json",
  "configId": "xai/grok-imagine-image",
  "displayName": "Grok Imagine Image",
  "aspectRatios": [
    "1:1",
    "3:2",
    "2:3",
    "16:9",
    "9:16",
    "4:3",
    "3:4",
    "2:1",
    "1:2",
    "19.5:9",
    "9:19.5",
    "20:9",
    "9:20",
    "21:9",
    "5:2"
  ],
  "aspectRatioLabels": {
    "2:1": "2:1",
    "1:2": "1:2",
    "19.5:9": "19.5:9",
    "9:19.5": "9:19.5",
    "20:9": "20:9",
    "9:20": "9:20",
    "21:9": "21:9",
    "5:2": "5:2"
  },
  "maxImagesPerRequest": 4,
  "supportsReferenceImages": false
}
